{
  "$schema": "../../../schemas/handoff.schema.json",
  "_note": "Draft Slice 02 producer handoff. The exact implementation commit is pinned in the evidence strings below and in the companion README. This remains draft because the commit has no verified annotated tag and no exposed green CI result; it is not a sealed_tagged checkpoint.",
  "sliceId": "FATES-SLICE-002",
  "repository": "ananke",
  "handoffStatus": "draft",
  "startingCommit": "86eb983fbd16cefb3218f438d2f44a246b27c5d0",
  "tag": null,
  "protocol": "1.4.0",
  "contractsUsed": [
    "project-runtime-contracts@0.4.0",
    "protocol 1.4.0; minimum 1.0.0"
  ],
  "publicSurfacesAddedOrChanged": [
    "producerCommit=552686fe6e01e2c0bf41ccb52591076bfa68bc2c; branch=codex/slice-002-bounded-read-design; parent=86eb983fbd16cefb3218f438d2f44a246b27c5d0; activatedBaseline=dcbb115c5798072221afdd2e4fdd36e786defddf; baseline ancestry verified",
    "action=fates.slice02.inspect-fixed-fixture.v1; requestSchemaId=urn:fates:slice02:inspect-fixed-fixture-request:v1; requestSchemaSha256=db1864fdc4978d6befb4b6d3913461e4f2d2732dd0ca87e076977ab98cf6049c; acceptedProperties=fixtureId,expectedSha256; additionalProperties=false",
    "fixtureId=fates.slice02.fixed-fixture.v1; fixturePath=packages/runtime-core/fixtures/fates-slice-002/fates.slice02.fixed-fixture.v1.txt; byteLength=43; sha256=7b28f52d84b07bed8b49650960607e8f8a9809cac299810aba691f7f52fe9ae8",
    "runtimeSurface=/api/runtime/identity,/api/runtime/registration,/api/runtime/health,/api/runtime/readiness,/api/runtime/compatibility,/api/runtime/negotiate,/api/tools"
  ],
  "explicitlyUnavailableSurfaces": [
    "No Horae handoff/relay, Moirae constrained host, or real three-process route is claimed by this producer handoff.",
    "Integration, Horae, and Moirae Code are not authorized to read or host the Ananke-owned fixture; Integration retains identity and digest only.",
    "No retry, persistence, idempotency, reconciliation, memory, content preflight, provider, network, credential, browser, shell, workflow, arbitrary filesystem, or global host-governance capability is included."
  ],
  "breakingChanges": [],
  "migrationNotes": "Consume the producer at exact commit 552686fe6e01e2c0bf41ccb52591076bfa68bc2c on branch codex/slice-002-bounded-read-design; do not use a later branch head as authority. The schema's endingCommit is intentionally null for this draft packet because completed handoffs require an annotated tag; the exact producer commit is therefore pinned in publicSurfacesAddedOrChanged and this note. Horae must preserve the typed Ananke evidence and revalidate the pinned runtime surface before any future dispatch.",
  "testsRun": [
    "Task-run at the exact producer commit: npm.cmd test -- packages/runtime-core/src/slice02-fixed-fixture.test.ts — 1 file, 8 tests passed.",
    "Owner-local Slice 02 coverage: registration/closed schema, one-read completion, policy denial zero-read, extra-argument rejection, invalid authority/origin/schema zero-read, digest mismatch one-read/no-retry, and audit-failure fail-closed behavior.",
    "Recorded candidate validation from the active task starting facts: full serialized Ananke suite 16 files/129 tests, build, ESLint, changed-file Prettier, and Integration validators 55/55; these are recorded facts, not reclassified as cross-runtime proof."
  ],
  "consumerTestsRequired": [
    "Horae must consume the exact Ananke commit and handoff, admit only fresh pinned identity/registration/compatibility/health/readiness evidence, dispatch once without authority or fixture access, and relay typed outcomes without rewriting producer IDs or correlation.",
    "Future real Integration proof must establish the frozen positive and negative cases, including physical-read separation, timeout/indeterminate semantics, no direct Moirae-to-Ananke fallback, and no non-Ananke fixture read."
  ],
  "knownConstraints": [
    "checkpointState=pushed_untagged, not sealed_tagged: exact commit is clean locally and the remote branch refs/heads/codex/slice-002-bounded-read-design resolves to it.",
    "No annotated tag points to the exact producer commit. No CI run exists for this producer commit yet: the repository CI workflow runs on pushes to main or pull requests targeting main, and this implementation was pushed only to codex/slice-002-bounded-read-design.",
    "This packet is owner-local evidence only. It does not claim a real process-boundary handoff, Horae relay, Moirae host, OS file-access proof, or Integration acceptance evidence.",
    "Runtime Contracts, fates-lock.json, compatibility-matrix.json, the Stage-A compatibility snapshot, and Slice 02 completion/seal status remain unchanged."
  ],
  "pushStatus": "pushed",
  "ciStatus": "not_run",
  "worktreeState": "clean"
}
