{
  "$schema": "../../../schemas/handoff.schema.json",
  "_note": "This is template data, not real evidence. Do not use as acceptance proof.",
  "sliceId": "FATES-SLICE-NNN",
  "repository": "example-repository",
  "handoffStatus": "draft",
  "startingCommit": "0000000000000000000000000000000000000000",
  "pushStatus": "not_pushed",
  "protocol": "1.4.0",
  "contractsUsed": ["project-runtime-contracts@0.0.0"],
  "publicSurfacesAddedOrChanged": ["Describe any new or changed public API surfaces."],
  "explicitlyUnavailableSurfaces": ["Describe any surfaces that are explicitly unavailable."],
  "breakingChanges": [],
  "migrationNotes": "Describe any migration steps required.",
  "testsRun": [],
  "consumerTestsRequired": ["List tests that consumers must run."],
  "knownConstraints": ["List known constraints or limitations."],
  "ciStatus": "not_run",
  "worktreeState": "unknown"
}
